<?xml version="1.0" encoding="utf-8"?>
<!DOCTYPE list SYSTEM "spawn.dtd">
<list>
	<spawn count="1" respawn="60" respawn_random="0" period_of_day="none">
		<territory>
			<add x="-101237" y="103989" zmin="-3692" zmax="-2992"/>
			<add x="-99708" y="100418" zmin="-3692" zmax="-2992"/>
			<add x="-98553" y="100158" zmin="-3692" zmax="-2992"/>
			<add x="-98637" y="104050" zmin="-3692" zmax="-2992"/>
		</territory>
		<npc id="20495"/><!--Turek Orc Warlord-->
	</spawn>
	<spawn count="2" respawn="60" respawn_random="0" period_of_day="none">
		<territory>
			<add x="-101237" y="103989" zmin="-3692" zmax="-2992"/>
			<add x="-99708" y="100418" zmin="-3692" zmax="-2992"/>
			<add x="-98553" y="100158" zmin="-3692" zmax="-2992"/>
			<add x="-98637" y="104050" zmin="-3692" zmax="-2992"/>
		</territory>
		<npc id="20497"/><!--Turek Orc Skirmisher-->
	</spawn>
	<spawn count="2" respawn="60" respawn_random="0" period_of_day="none">
		<territory>
			<add x="-100571" y="106885" zmin="-3715" zmax="-3015"/>
			<add x="-100403" y="104743" zmin="-3715" zmax="-3015"/>
			<add x="-98598" y="104208" zmin="-3715" zmax="-3015"/>
			<add x="-98544" y="109423" zmin="-3715" zmax="-3015"/>
		</territory>
		<npc id="20497"/><!--Turek Orc Skirmisher-->
	</spawn>
	<spawn count="2" respawn="60" respawn_random="0" period_of_day="none">
		<territory>
			<add x="-101237" y="103989" zmin="-3692" zmax="-2992"/>
			<add x="-99708" y="100418" zmin="-3692" zmax="-2992"/>
			<add x="-98553" y="100158" zmin="-3692" zmax="-2992"/>
			<add x="-98637" y="104050" zmin="-3692" zmax="-2992"/>
		</territory>
		<npc id="20498"/><!--Turek Orc Supplier-->
	</spawn>
	<spawn count="2" respawn="60" respawn_random="0" period_of_day="none">
		<territory>
			<add x="-100571" y="106885" zmin="-3715" zmax="-3015"/>
			<add x="-100403" y="104743" zmin="-3715" zmax="-3015"/>
			<add x="-98598" y="104208" zmin="-3715" zmax="-3015"/>
			<add x="-98544" y="109423" zmin="-3715" zmax="-3015"/>
		</territory>
		<npc id="20498"/><!--Turek Orc Supplier-->
	</spawn>
	<spawn count="1" respawn="60" respawn_random="0" period_of_day="none">
		<territory>
			<add x="-101237" y="103989" zmin="-3692" zmax="-2992"/>
			<add x="-99708" y="100418" zmin="-3692" zmax="-2992"/>
			<add x="-98553" y="100158" zmin="-3692" zmax="-2992"/>
			<add x="-98637" y="104050" zmin="-3692" zmax="-2992"/>
		</territory>
		<npc id="20501"/><!--Turek Orc Shaman-->
	</spawn>
	<spawn count="2" respawn="60" respawn_random="0" period_of_day="none">
		<territory>
			<add x="-100571" y="106885" zmin="-3715" zmax="-3015"/>
			<add x="-100403" y="104743" zmin="-3715" zmax="-3015"/>
			<add x="-98598" y="104208" zmin="-3715" zmax="-3015"/>
			<add x="-98544" y="109423" zmin="-3715" zmax="-3015"/>
		</territory>
		<npc id="20501"/><!--Turek Orc Shaman-->
	</spawn>
</list>