<?xml version="1.0" encoding="utf-8"?>
<!DOCTYPE list SYSTEM "spawn.dtd">
<list>
	<spawn count="1" respawn="86400" respawn_random="21600" period_of_day="none">
		<point x="-213004" y="175631" z="-11978" h="16380"/>
		<npc id="25698"/><!--Dopagen-->
	</spawn>
	<spawn count="1" respawn="0" respawn_random="0" period_of_day="none">
		<point x="-213003" y="175497" z="-11952" h="16562"/>
		<npc id="18844"/><!--Reptilikon's Ward-->
	</spawn>
	<spawn count="1" respawn="0" respawn_random="0" period_of_day="none">
		<point x="-213003" y="176830" z="-12280" h="48776"/>
		<npc id="18844"/><!--Reptilikon's Ward-->
	</spawn>
</list>